{
  "$schema": "https://json-schema.org/draft/2020-12/schema",
  "$id": "https://lensgraph.dev/schemas/gold_example.schema.json",
  "title": "LensGraph Gold Example",
  "description": "Eval ground truth. Provenance lives on talks (see talk.schema.json), not on examples.",
  "type": "object",
  "additionalProperties": false,
  "required": [
    "id",
    "question",
    "split",
    "question_type",
    "modality",
    "difficulty",
    "verified",
    "curator",
    "curated_at"
  ],
  "properties": {
    "id": {
      "type": "string",
      "pattern": "^[a-z0-9_-]+$",
      "description": "Stable kebab/snake-case ID. Used to join with eval results."
    },
    "question": { "type": "string", "minLength": 15 },
    "video_id": {
      "type": "string",
      "description": "Required for single_clip and negative+scope=video. Forbidden for synthesis and negative+scope=corpus."
    },
    "talk_title": { "type": "string" },
    "split": { "enum": ["dev", "test"] },
    "question_type": { "enum": ["single_clip", "synthesis", "negative"] },
    "negative_scope": {
      "enum": ["video", "corpus"],
      "description": "Required when question_type=negative. corpus=no video in the corpus answers it (primary abstention signal). video=this video does not but corpus might."
    },
    "gold_spans": {
      "type": "array",
      "items": {
        "type": "object",
        "additionalProperties": false,
        "required": ["start_sec", "end_sec"],
        "properties": {
          "start_sec": { "type": "number", "minimum": 0 },
          "end_sec": { "type": "number", "minimum": 0 },
          "video_id": { "type": "string" }
        }
      }
    },
    "expected_answer": {
      "type": ["string", "null"],
      "description": "Free-form reference answer for human inspection. Not consumed by the judge."
    },
    "expected_claims": {
      "type": "array",
      "items": { "type": "string", "minLength": 10 },
      "description": "Atomic claims the answer must contain. Faithfulness judge scores claim-by-claim."
    },
    "abstention_expected": { "type": "boolean", "default": false },
    "modality": {
      "type": "array",
      "minItems": 1,
      "items": {
        "enum": [
          "transcript",
          "slide",
          "screen_code",
          "diagram",
          "whiteboard",
          "audio_only"
        ]
      }
    },
    "difficulty": { "enum": ["easy", "medium", "hard"] },
    "tags": { "type": "array", "items": { "type": "string" } },
    "curator": { "type": "string", "minLength": 1 },
    "curated_at": { "type": "string", "format": "date-time" },
    "verified": {
      "type": "boolean",
      "description": "Validator rejects unverified examples committed to corpora files."
    },
    "curation_source_version": {
      "type": "string",
      "description": "git SHA of curation tooling used to draft this example."
    },
    "visual_evidence": {
      "type": "array",
      "minItems": 1,
      "description": "Optional. Curator-supplied required-answer terms confirmed against a specific visual element on the gold frame. When present, the text-side metric (AnswerTermHit@k) runs for this row: each entry asserts that at least one of `required_any` MUST appear, normalized, in the TRANSCRIPT TEXT of some retrieved chunk for the entry to pass. Entries are conjoined (all must pass). The metric does NOT validate the field against any visual model output, OCR, or human-confirmed frame ID; the field name describes provenance (the curator saw the term on the slide), and the check runs on transcript text.",
      "items": {
        "type": "object",
        "additionalProperties": false,
        "required": ["visual_element", "required_any"],
        "properties": {
          "visual_element": {
            "type": "string",
            "minLength": 3,
            "description": "Short label for the visual surface the terms came from (e.g. 'plot y-axis', 'code block', 'slide title'). Audit only — never compared against retrieved text."
          },
          "required_any": {
            "type": "array",
            "minItems": 1,
            "items": { "type": "string", "minLength": 1 },
            "description": "Disjunction. The entry passes if ANY one of these normalized terms appears as a substring in the retrieved chunk's normalized text. Terms should be the exact answer-bearing strings the curator confirmed on the frame."
          },
          "normalize": {
            "enum": ["lowercase_collapse_ws", "exact"],
            "default": "lowercase_collapse_ws",
            "description": "How the term and the candidate chunk text are normalized before substring compare. `lowercase_collapse_ws` lowercases and collapses runs of whitespace; `exact` is byte-for-byte. Code identifiers and exact UI strings use `exact`."
          }
        }
      }
    }
  },
  "allOf": [
    {
      "if": {
        "properties": { "question_type": { "const": "single_clip" } },
        "required": ["question_type"]
      },
      "then": {
        "required": ["video_id", "gold_spans", "expected_claims"],
        "properties": {
          "gold_spans": { "minItems": 1, "maxItems": 1 },
          "abstention_expected": { "const": false }
        }
      }
    },
    {
      "if": {
        "properties": { "question_type": { "const": "synthesis" } },
        "required": ["question_type"]
      },
      "then": {
        "required": ["gold_spans", "expected_claims"],
        "not": { "required": ["video_id"] },
        "properties": {
          "gold_spans": {
            "minItems": 2,
            "items": { "required": ["start_sec", "end_sec", "video_id"] }
          },
          "abstention_expected": { "const": false }
        }
      }
    },
    {
      "if": {
        "properties": { "question_type": { "const": "negative" } },
        "required": ["question_type"]
      },
      "then": {
        "required": ["negative_scope"],
        "properties": {
          "gold_spans": { "maxItems": 0 },
          "abstention_expected": { "const": true },
          "expected_answer": { "type": "null" }
        }
      }
    },
    {
      "if": {
        "allOf": [
          { "properties": { "question_type": { "const": "negative" } }, "required": ["question_type"] },
          { "properties": { "negative_scope": { "const": "video" } }, "required": ["negative_scope"] }
        ]
      },
      "then": { "required": ["video_id"] }
    },
    {
      "if": {
        "allOf": [
          { "properties": { "question_type": { "const": "negative" } }, "required": ["question_type"] },
          { "properties": { "negative_scope": { "const": "corpus" } }, "required": ["negative_scope"] }
        ]
      },
      "then": { "not": { "required": ["video_id"] } }
    },
    {
      "if": { "required": ["visual_evidence"] },
      "then": {
        "properties": {
          "modality": {
            "contains": {
              "enum": ["slide", "screen_code", "diagram", "whiteboard"]
            }
          }
        }
      }
    }
  ]
}
