{
  "id": "fixture_synthesis_001",
  "question": "How do speakers A and B disagree about whether semantic chunking is necessary for production RAG?",
  "split": "dev",
  "question_type": "synthesis",
  "gold_spans": [
    { "start_sec": 100, "end_sec": 150, "video_id": "video_a" },
    { "start_sec": 200, "end_sec": 260, "video_id": "video_b" }
  ],
  "expected_claims": [
    "Speaker A argues fixed-window chunking is sufficient for most production workloads.",
    "Speaker B counters that semantic chunking is required when documents have heterogeneous structure."
  ],
  "modality": ["transcript", "slide"],
  "difficulty": "hard",
  "verified": true,
  "curator": "fixture",
  "curated_at": "2026-05-24T10:00:00Z"
}
